{"checks": [{"check_id": "columns", "message": "资产账实不符 1 项", "status": "fail"}], "contract_id": "dataset-validation", "contract_version": "1.0.0", "snapshot_sha256": "e7d28314de6f91cdf9629a0d1cdd47a8f8f9d46770818d60a7314dfe1b5d0f37", "summary": {"checked_columns": 2, "checked_rows": 2, "missing_values": 0, "valid": false}, "violations": [{"check_id": "columns", "message": "资产账实不符 asset_code=AST-002 账面位置 机房B 实盘位置 仓库C"}]}