{"checks": [{"check_id": "missing_rate", "message": "材料缺失 3 项", "status": "fail"}], "contract_id": "dataset-validation", "contract_version": "1.0.0", "snapshot_sha256": "fc24960d39c206938c31058e9ce8548b9cf2368bf1a24422bf775c66a08529c3", "summary": {"checked_columns": 5, "checked_rows": 2, "missing_values": 3, "valid": false}, "violations": [{"check_id": "missing_rate", "message": "单位 采购部 缺少必报材料：财务报表"}, {"check_id": "missing_rate", "message": "单位 采购部 缺少必报材料：内控文档"}, {"check_id": "missing_rate", "message": "单位 采购部 缺少必报材料：资金流水"}]}