{
  "checks": [
    {
      "check_id": "columns",
      "message": "method:materiality population:4 sample_size:2 items:I1,I2",
      "status": "pass"
    }
  ],
  "contract_id": "dataset-validation",
  "contract_version": "1.0.0",
  "snapshot_sha256": "82c5a3f39d0d178f548ceedb118f9532156a3f7e8a69e8c5452b99a9fe033102",
  "summary": {
    "checked_columns": 2,
    "checked_rows": 4,
    "missing_values": 0,
    "valid": true
  },
  "violations": []
}